{
  "blocked_reason": {
    "detail": "CQ-012 is BROWSER_DISABLED; no isolated browser launcher is qualified",
    "kind": "ACCESS"
  },
  "case_definition_digest": "46da04ae2974856d8b826e85ef3347f7b53211ed74ea840ef5b4c1c305d02eac",
  "case_id": "HC-009",
  "cleanup_result": "NOT_APPLICABLE",
  "containment_result": "NOT_APPLICABLE",
  "contradictions": [],
  "control_results": {
    "negative": "NOT_RUN",
    "positive": "NOT_RUN"
  },
  "coverage_level": "FIXTURE_HOST",
  "evidence": [
    {
      "kind": "validated-scenario-observation",
      "observation_digest": "2fd188a5d438f5d01dcdf9c3f14aa19dd326022be9f7e6c389df2b8761ae490e",
      "qualification_digest": "9f896a138a05f1ac9bd8a160d53bd0b1ae6fe967ffc3495e9e359dd9f45b6720"
    }
  ],
  "finished_at": "2026-07-19T11:44:44.897313Z",
  "limitations": [
    "The case definition is not an execution result.",
    "Coverage cannot exceed the declared evidence ceiling.",
    "Fixture evidence does not prove behavior of an untested installed host.",
    "No browser or embedded-webview behavior was executed."
  ],
  "observations": [
    {
      "browser_mode": "BROWSER_DISABLED",
      "browser_required": true,
      "unsafe_fallback_refused": true
    }
  ],
  "oracle_version": "MHAI-ORACLE-1",
  "protocol_status": "DRAFT_OR_EMERGING",
  "result": "BLOCKED_BY_ACCESS",
  "run_id": "run-1784461483-9e9faacaa0da",
  "started_at": "2026-07-19T11:44:44.896863Z",
  "subject": "Web tool registrations remain origin-, frame-, and document-lifecycle-bound.",
  "subject_version": "fixture:MHAI-host-confused-deputy-1@sha256:015bd5099ab40146443997ca53cd45575325003459931d62ef7ec2cca49fd122",
  "target_verdict": "BLOCKED"
}
