{
  "blocked_reason": null,
  "case_definition_digest": "96302378164dbe28bef0846f5296e7f14a2ceef4214f835b92077457751d9f44",
  "case_id": "LP-003",
  "cleanup_result": "PASS",
  "containment_result": "PASS",
  "contradictions": [],
  "control_results": {
    "negative": "PASS",
    "positive": "PASS"
  },
  "coverage_level": "FIXTURE_HOST",
  "evidence": [
    {
      "kind": "validated-scenario-observation",
      "observation_digest": "4a9c1ed3fa835ea0bae10f7885fd50301dc6f575d3148a29c20237c9cf25e2bc",
      "qualification_digest": "eb27bbcfbd29b813782771f39dd1ee1d3973bac9b1cbd3cda451a50dfdf0bd56"
    }
  ],
  "finished_at": "2026-07-19T20:28:01.450292Z",
  "limitations": [
    "The case definition is not an execution result.",
    "Coverage cannot exceed the declared evidence ceiling.",
    "Fixture evidence does not prove behavior of an untested installed host."
  ],
  "observations": [
    {
      "attack_variants": [
        "sibling-replay",
        "later-run-replay",
        "modified-arguments",
        "different-server",
        "expired-approval"
      ],
      "broker_attempts": [
        {
          "allowed": true,
          "effect": "write_canary",
          "name": "positive-control.json"
        },
        {
          "allowed": false,
          "effect": "write_canary",
          "name": "safe-subject.json"
        }
      ],
      "case_id": "LP-003",
      "positive_canary_detected": true,
      "safe_canary_absent": true,
      "safe_decisions": [
        {
          "accepted": false,
          "reason": "approval binds run, principal, server, operation, arguments, and expiry",
          "variant": "sibling-replay"
        },
        {
          "accepted": false,
          "reason": "approval binds run, principal, server, operation, arguments, and expiry",
          "variant": "later-run-replay"
        },
        {
          "accepted": false,
          "reason": "approval binds run, principal, server, operation, arguments, and expiry",
          "variant": "modified-arguments"
        },
        {
          "accepted": false,
          "reason": "approval binds run, principal, server, operation, arguments, and expiry",
          "variant": "different-server"
        },
        {
          "accepted": false,
          "reason": "approval binds run, principal, server, operation, arguments, and expiry",
          "variant": "expired-approval"
        }
      ],
      "vulnerable_control_accepted": [
        "different-server",
        "expired-approval",
        "later-run-replay",
        "modified-arguments",
        "sibling-replay"
      ]
    },
    {
      "authority_tuple_dimensions": [
        "principal",
        "server",
        "operation",
        "arguments",
        "scope",
        "expiry"
      ],
      "exact_tuple_required": true
    }
  ],
  "oracle_version": "MHAI-ORACLE-1",
  "protocol_status": "FIXTURE_SECURITY_INVARIANT",
  "result": "PASS",
  "run_id": "run-1784492867-4d4329d1cf59",
  "started_at": "2026-07-19T20:28:01.449509Z",
  "subject": "Synthetic approval is bound to actor, server, action, normalized arguments, target, and expiry.",
  "subject_version": "fixture:MHAI-local-privilege-containment-1@sha256:8261000263f7e12a711f22cc0ad5ff1890d0639440e2d9e341c7c26e31859035",
  "target_verdict": "PASS"
}
