{
  "blocked_reason": {
    "detail": "No fidelity-proven immutable mcp-trust archive is bound to this run.",
    "kind": "ACCESS"
  },
  "case_definition_digest": "48d64fdb02b479301f572baf49e6af9acb4b8d74ed054ae59af5069d9f59100b",
  "case_id": "RT-012",
  "cleanup_result": "NOT_APPLICABLE",
  "containment_result": "NOT_APPLICABLE",
  "contradictions": [],
  "control_results": {
    "negative": "NOT_RUN",
    "positive": "NOT_RUN"
  },
  "coverage_level": "LIVE_TARGET",
  "evidence": [
    {
      "kind": "validated-scenario-observation",
      "observation_digest": "897a197e986b6708ed4d6ee89ab8267fd2d791defcf5c5f53e46d3ee2e3fe4dd",
      "qualification_digest": "93e9eadcc06df5b46eb32eef4fc1e54de01fa93e8c69f4574065eedd2427f5d1"
    }
  ],
  "finished_at": "2026-07-19T13:33:51.007338Z",
  "limitations": [
    "The case definition is not an execution result.",
    "Coverage cannot exceed the declared evidence ceiling.",
    "Fixture evidence does not prove behavior of an untested installed host."
  ],
  "observations": [
    {
      "archive_created": false,
      "archive_fidelity_proven": false,
      "target_code_executed": false,
      "target_head": "2e6b0ddf4d16ec910eb44eec4b324158e0a79ce3"
    }
  ],
  "oracle_version": "MHAI-ORACLE-1",
  "protocol_status": "LOCAL_CONTRACT",
  "result": "BLOCKED_BY_ACCESS",
  "run_id": "run-1784468030-1099ef795c1c",
  "started_at": "2026-07-19T13:33:51.006141Z",
  "subject": "The exact pinned mcp-trust read-only interface claim is compared with only behavior observable without mutation.",
  "subject_version": "git:2e6b0ddf4d16ec910eb44eec4b324158e0a79ce3",
  "target_verdict": "BLOCKED"
}
