{
  "blocked_reason": null,
  "case_definition_digest": "4c51be4a5453747ff38098533ec30667e40529a451189e0ba027771daba0991f",
  "case_id": "SA-009",
  "cleanup_result": "PASS",
  "containment_result": "PASS",
  "contradictions": [],
  "control_results": {
    "negative": "PASS",
    "positive": "PASS"
  },
  "coverage_level": "FIXTURE_HOST",
  "evidence": [
    {
      "kind": "validated-scenario-observation",
      "observation_digest": "2d8610ca51b36052970f69332c20cf6e1757782e182f75c28185546d184a7af3",
      "qualification_digest": "8f96d2dd3a4ee7c36acd860eccf2859bcc7db012bd92331db24045666d047f26"
    }
  ],
  "finished_at": "2026-07-19T13:45:43.419732Z",
  "limitations": [
    "The case definition is not an execution result.",
    "Coverage cannot exceed the declared evidence ceiling.",
    "Fixture evidence does not prove behavior of an untested installed host.",
    "Parent association is SEP-2260 final-proposal behavior, not 2025-11-25 released core."
  ],
  "observations": [
    {
      "case_id": "SA-009",
      "control_domains": {
        "negative": {
          "domain_id": "sa-009-negative",
          "facts": {
            "live_parent_control_accepted": true,
            "rejected_associations": [
              "elicitation_after_completion",
              "roots_forged_parent",
              "sampling_without_parent"
            ],
            "released_shapes": []
          },
          "pass_oracle_observed": true,
          "safe_fixture": true
        },
        "positive": {
          "deliberately_vulnerable": true,
          "domain_id": "sa-009-positive",
          "facts": {
            "released_shapes": [
              "elicitation_after_completion",
              "roots_forged_parent"
            ]
          },
          "fail_oracle_observed": true
        }
      },
      "evidence_basis": "Parent association is SEP-2260 final-proposal behavior, not 2025-11-25 released core.",
      "fail_oracle": "Any forged or stale association releases model, user, or filesystem-shaped synthetic data.",
      "pass_oracle": "Requests without a parent, after completion, or with a forged parent are rejected without releasing data.",
      "protocol_status": "FINAL_PROPOSAL",
      "synthetic_only": true
    }
  ],
  "oracle_version": "MHAI-ORACLE-1",
  "protocol_status": "FINAL_PROPOSAL",
  "result": "PASS",
  "run_id": "run-1784468743-a620d6649541",
  "started_at": "2026-07-19T13:45:43.417968Z",
  "subject": "Sampling, elicitation, and roots requests require a valid live parent request.",
  "subject_version": "fixture:MHAI-stateless-authority-1@sha256:df7979c40a5b4f5d2a726fde8b8cbe4e1f4d3e52db22088639007df78d0d1b9d",
  "target_verdict": "PASS"
}
