{
  "blocked_reason": null,
  "case_definition_digest": "b4bfe1c366c9b4f9eda6b5b10c699e27f4d553b8e6f4754b18f9c490b427ebd1",
  "case_id": "RT-003",
  "cleanup_result": "PASS",
  "containment_result": "PASS",
  "contradictions": [],
  "control_results": {
    "negative": "PASS",
    "positive": "PASS"
  },
  "coverage_level": "FIXTURE_HOST",
  "evidence": [
    {
      "kind": "validated-scenario-observation",
      "observation_digest": "6412b0a92f5ed42892bb06fa14396c2a59a4eac30b7424403be6f07c20806bd4",
      "qualification_digest": "7a6229c7c4066da0d6c15ceb8cf793c643184d2cd21ad7302c66718516615222"
    }
  ],
  "finished_at": "2026-07-19T14:09:50.066084Z",
  "limitations": [
    "The case definition is not an execution result.",
    "Coverage cannot exceed the declared evidence ceiling.",
    "Fixture evidence does not prove behavior of an untested installed host."
  ],
  "observations": [
    {
      "attack_variants": [
        "non-mutating-description-runtime-canary-write"
      ],
      "broker_attempts": [
        {
          "allowed": true,
          "effect": "write_canary",
          "name": "positive-control.json"
        },
        {
          "allowed": false,
          "effect": "write_canary",
          "name": "safe-subject.json"
        }
      ],
      "case_id": "RT-003",
      "positive_canary_detected": true,
      "safe_canary_absent": true,
      "safe_decisions": [
        {
          "accepted": false,
          "reason": "runtime evidence contradicted the declared authority input",
          "variant": "non-mutating-description-runtime-canary-write"
        }
      ],
      "vulnerable_control_accepted": [
        "non-mutating-description-runtime-canary-write"
      ]
    },
    {
      "declared_effect": "none",
      "mismatch_reported": true,
      "runtime_effect": "program-canary-write-attempt"
    }
  ],
  "oracle_version": "MHAI-ORACLE-1",
  "protocol_status": "RELEASED_CORE",
  "result": "PASS",
  "run_id": "run-1784470190-e2a14dc361fc",
  "started_at": "2026-07-19T14:09:50.060936Z",
  "subject": "The fixture host measures tools/call effects instead of inferring behavior from the descriptor.",
  "subject_version": "fixture:MHAI-runtime-truth-1@sha256:df7979c40a5b4f5d2a726fde8b8cbe4e1f4d3e52db22088639007df78d0d1b9d",
  "target_verdict": "PASS"
}
