{
  "blocked_reason": {
    "detail": "CQ-012 is BROWSER_DISABLED; locally cached candidates failed repeatable bounded launcher qualification",
    "kind": "ACCESS"
  },
  "case_definition_digest": "084d0e6537fee916af182ecf539eea60d4eb13b4368269bc1cd248e6eb4e7488",
  "case_id": "OA-005",
  "cleanup_result": "NOT_APPLICABLE",
  "containment_result": "NOT_APPLICABLE",
  "contradictions": [],
  "control_results": {
    "negative": "NOT_RUN",
    "positive": "NOT_RUN"
  },
  "coverage_level": "FIXTURE_HOST",
  "evidence": [
    {
      "kind": "validated-scenario-observation",
      "observation_digest": "2fd188a5d438f5d01dcdf9c3f14aa19dd326022be9f7e6c389df2b8761ae490e",
      "qualification_digest": "93e9eadcc06df5b46eb32eef4fc1e54de01fa93e8c69f4574065eedd2427f5d1"
    }
  ],
  "finished_at": "2026-07-19T13:33:54.320761Z",
  "limitations": [
    "The case definition is not an execution result.",
    "Coverage cannot exceed the declared evidence ceiling.",
    "Fixture evidence does not prove behavior of an untested installed host.",
    "No browser or embedded-webview behavior was executed."
  ],
  "observations": [
    {
      "browser_mode": "BROWSER_DISABLED",
      "browser_required": true,
      "unsafe_fallback_refused": true
    }
  ],
  "oracle_version": "MHAI-ORACLE-1",
  "protocol_status": "DRAFT_OR_EMERGING",
  "result": "BLOCKED_BY_ACCESS",
  "run_id": "run-1784468030-1099ef795c1c",
  "started_at": "2026-07-19T13:33:54.318614Z",
  "subject": "The approval surface exposes and binds the actual redirect target rather than trusting a legitimate-looking metadata identity.",
  "subject_version": "fixture:MHAI-stateless-authority-1@sha256:df7979c40a5b4f5d2a726fde8b8cbe4e1f4d3e52db22088639007df78d0d1b9d",
  "target_verdict": "BLOCKED"
}
