{
  "blocked_reason": null,
  "case_definition_digest": "5372b12ed84adc86976404b1d4d11dc955570a6df9e1face40b78b7513fb29d1",
  "case_id": "SA-007",
  "cleanup_result": "PASS",
  "containment_result": "PASS",
  "contradictions": [],
  "control_results": {
    "negative": "PASS",
    "positive": "PASS"
  },
  "coverage_level": "FIXTURE_SERVER",
  "evidence": [
    {
      "kind": "validated-scenario-observation",
      "observation_digest": "1b555ab11a8d5c7e456a5ba4a16eaebaa7bcd26041bece4c28c973bd9ceb3ea6",
      "qualification_digest": "7a6229c7c4066da0d6c15ceb8cf793c643184d2cd21ad7302c66718516615222"
    }
  ],
  "finished_at": "2026-07-19T14:09:50.317962Z",
  "limitations": [
    "The case definition is not an execution result.",
    "Coverage cannot exceed the declared evidence ceiling.",
    "Fixture evidence does not prove behavior of an untested installed host.",
    "MCP cancellation is cooperative; cessation truth is an explicit fixture safety invariant."
  ],
  "observations": [
    {
      "case_id": "SA-007",
      "control_domains": {
        "negative": {
          "domain_id": "sa-007-negative",
          "facts": {
            "post_cancel_canaries": 0,
            "reconciled_schedules": [
              "cancel_at_boundary",
              "cancel_before_work",
              "complete_before_cancel"
            ]
          },
          "pass_oracle_observed": true,
          "safe_fixture": true
        },
        "positive": {
          "deliberately_vulnerable": true,
          "domain_id": "sa-007-positive",
          "facts": {
            "misreported_schedules": [
              "cancel_at_boundary",
              "cancel_before_work"
            ]
          },
          "fail_oracle_observed": true
        }
      },
      "evidence_basis": "MCP cancellation is cooperative; cessation truth is an explicit fixture safety invariant.",
      "fail_oracle": "The client reports cancellation while work continues or the boundary is crossed later.",
      "pass_oracle": "All race schedules reconcile to stopped or completed truth and no post-cancel canary appears.",
      "protocol_status": "RELEASED_EXPERIMENTAL",
      "synthetic_only": true
    }
  ],
  "oracle_version": "MHAI-ORACLE-1",
  "protocol_status": "RELEASED_EXPERIMENTAL",
  "result": "PASS",
  "run_id": "run-1784470190-e2a14dc361fc",
  "started_at": "2026-07-19T14:09:50.305423Z",
  "subject": "Cancellation is reported only after fixture work has verifiably ceased at the synthetic boundary.",
  "subject_version": "fixture:MHAI-stateless-authority-1@sha256:df7979c40a5b4f5d2a726fde8b8cbe4e1f4d3e52db22088639007df78d0d1b9d",
  "target_verdict": "PASS"
}
