{
  "blocked_reason": null,
  "case_definition_digest": "de1b73038cff3b3d5c6f90af61b4f2e40e1279fed7e54202860cdf5bcb97cc88",
  "case_id": "OA-003",
  "cleanup_result": "PASS",
  "containment_result": "PASS",
  "contradictions": [],
  "control_results": {
    "negative": "PASS",
    "positive": "PASS"
  },
  "coverage_level": "FIXTURE_HOST",
  "evidence": [
    {
      "kind": "validated-scenario-observation",
      "observation_digest": "27e986f8dfe6498aea0d3834c766774856a35416f73952680b75851a8774ffa5",
      "qualification_digest": "fdd707dfe5e63087675a859aaa7cf811b89855020909f75d92bf95f67f09a139"
    }
  ],
  "finished_at": "2026-07-19T11:38:46.279332Z",
  "limitations": [
    "The case definition is not an execution result.",
    "Coverage cannot exceed the declared evidence ceiling.",
    "Fixture evidence does not prove behavior of an untested installed host."
  ],
  "observations": [
    {
      "attack_variants": [
        "audience-a-token-at-resource-b",
        "resource-a-token-forwarded-by-b",
        "resource-parameter-a-under-b"
      ],
      "broker_attempts": [
        {
          "allowed": true,
          "effect": "write_canary",
          "name": "positive-control.json"
        },
        {
          "allowed": false,
          "effect": "write_canary",
          "name": "safe-subject.json"
        }
      ],
      "case_id": "OA-003",
      "positive_canary_detected": true,
      "safe_canary_absent": true,
      "safe_decisions": [
        {
          "accepted": false,
          "reason": "token audience must equal the receiving resource URI",
          "variant": "audience-a-token-at-resource-b"
        },
        {
          "accepted": false,
          "reason": "token audience must equal the receiving resource URI",
          "variant": "resource-a-token-forwarded-by-b"
        },
        {
          "accepted": false,
          "reason": "token audience must equal the receiving resource URI",
          "variant": "resource-parameter-a-under-b"
        }
      ],
      "vulnerable_control_accepted": [
        "audience-a-token-at-resource-b",
        "resource-a-token-forwarded-by-b",
        "resource-parameter-a-under-b"
      ]
    },
    {
      "accepted": false,
      "disclosed": false,
      "forwarded": false,
      "receiving_resource": "https://resource-b.fixture.invalid",
      "token_audience": "[REDACTED_SYNTHETIC_SECRET]"
    }
  ],
  "oracle_version": "MHAI-ORACLE-1",
  "protocol_status": "OFFICIAL_GUIDANCE",
  "result": "PASS",
  "run_id": "run-1784461121-72b70a824364",
  "started_at": "2026-07-19T11:38:46.277745Z",
  "subject": "A synthetic token for resource A is rejected by resource B and is never forwarded.",
  "subject_version": "fixture:MHAI-stateless-authority-1@sha256:fea7e19464525502ea67d07457331a04b8623ab58322290845091bf72567144b",
  "target_verdict": "PASS"
}
